{
  "protocol": "qa-mesh/2.0",
  "schema_version": "2.0",
  "run_id": "2026-10-07-001",
  "agent": "agent-5",
  "status": "ok",
  "domain": "todo",
  "payload": {
    "results": [
      {
        "id": "r1",
        "spec": "tests/todo/todo.ajout.spec.ts",
        "title": "TC-001: ajout nominal",
        "status": "OK",
        "duration_ms": 800,
        "browser": "chromium"
      },
      {
        "id": "r2",
        "spec": "tests/todo/todo.ajout.spec.ts",
        "title": "TC-002: saisie vide",
        "status": "KO",
        "duration_ms": 5100,
        "browser": "chromium",
        "failure": {
          "kind": "SCRIPT",
          "line": 21,
          "message": "locator.click: Timeout 5000ms exceeded",
          "evidence_path": "test-results/r2/trace.zip",
          "code": "LOCATOR_NOT_FOUND",
          "trace_path": ".qa/runs/2026-10-07-001/results/tc-002-saisie-vide-1a2b3c4d/trace.md"
        }
      },
      {
        "id": "r3",
        "spec": "tests/todo/todo.compteur.spec.ts",
        "title": "TC-003: compteur",
        "status": "KO",
        "duration_ms": 900,
        "browser": "chromium",
        "failure": {
          "kind": "SCRIPT",
          "code": "ASSERTION_FAILED",
          "requalified_reason": "libellé du compteur renommé volontairement (ticket UX-12), assertion périmée",
          "message": "expect(locator).toHaveText(expected) failed"
        }
      }
    ],
    "bugs": [],
    "summary": {
      "total": 3,
      "pass": 1,
      "fail": 2,
      "skip": 0,
      "pass_rate_pct": 33.33,
      "flaky_pct": 0
    }
  },
  "errors": [],
  "metrics": {
    "duration_ms": 1200,
    "items_produced": 1
  }
}
