{
  "protocol": "qa-mesh/2.0",
  "schema_version": "2.0",
  "run_id": "2026-10-08-001",
  "agent": "agent-explore",
  "status": "ok",
  "domain": "todo",
  "payload": {
    "charter": {
      "index": 1,
      "title": "Ajout et compteur"
    },
    "status": "passed",
    "summary": "Ajout, coche et suppression parcourus ; compteur incohérent après ajout.",
    "actions_used": 12,
    "findings": [
      {
        "title": "Le compteur ne se met pas à jour après ajout",
        "kind": "issue",
        "severity": 4,
        "expected": "« 1 item left » après ajout d'une tâche",
        "actual": "« 0 items left » reste affiché",
        "repro_steps": [
          "ouvrir /",
          "saisir « Lait » puis Entrée",
          "lire le compteur en pied de liste"
        ],
        "route": "/",
        "screenshot_path": ".qa/runs/2026-10-08-001/explore/charter-1/finding-1.png"
      }
    ]
  }
}
