{
  "protocol": "qa-mesh/2.0",
  "schema_version": "2.0",
  "run_id": "2026-10-07-001",
  "agent": "agent-1",
  "status": "ok",
  "domain": "todo",
  "payload": {
    "commons": {
      "elements": [
        {
          "page": "*",
          "type": "link",
          "label": "Accueil",
          "selector_primary": "getByRole('link',{name:'Accueil'})"
        }
      ]
    },
    "pages": [
      {
        "url": "/todos",
        "title": "Todos",
        "complexity": "simple",
        "error_states": [
          {
            "trigger": "saisie vide",
            "message": "aucun item créé"
          }
        ]
      }
    ],
    "elements": [
      {
        "page": "/todos",
        "type": "textbox",
        "label": "Nouvelle tâche",
        "aria_role": "textbox",
        "selector_primary": "getByPlaceholder('What needs to be done?')",
        "selector_fallback": "getByRole('textbox')",
        "action": "fill"
      }
    ],
    "api_calls": [
      {
        "method": "POST",
        "endpoint": "/api/todos",
        "trigger": "Entrée"
      }
    ]
  },
  "errors": [],
  "metrics": {
    "duration_ms": 1200,
    "items_produced": 1
  }
}
